category,id,name,subtitle,price,description,image,includes
grabAndGo,gag-001,Mini Garland,1 metre,89,"Perfect for a small accent — a doorway, a table backdrop, or a simple pop of colour.",images/products/Product Staging-1973000a-99cb-4c64-980f-578da1e10a43.jpg,~40 balloons in 3 sizes | Garland tape | Ready to hang
grabAndGo,gag-002,Standard Garland,2 metres,149,"Our most popular size. Great for a backdrop, mantelpiece, or party table.",images/products/IMG_8318 (Product Staging).jpg,~80 balloons in 3 sizes | Garland tape | Hanging strips
grabAndGo,gag-003,Statement Garland,3 metres,199,"Make a real impact. Fills a full wall, archway, or entrance perfectly.",images/products/Product Staging-d48c002c-e24f-493f-8277-ea146c4abb49.jpg,~120 balloons in 3 sizes | Garland tape | Hanging strips
grabAndGo,gag-004,Arch Garland,4 metres,269,Go big. A full arch or long sweeping garland that becomes the centrepiece of any event.,images/products/Product Staging-9d68d698-ada3-4b0c-82ef-b3a77f9fe1c4.jpg,~160 balloons in 3 sizes | Garland tape | Hanging strips | Frame not included
diyKits,diy-001,Starter Kit,1 metre,49,"First time doing DIY? This is where to start. Everything you need, plus a step-by-step guide.",images/balloon-garlands/IMG_0287.jpeg,~40 balloons (3 sizes) | Garland tape | Tie tool | Command strips | How-to guide
diyKits,diy-002,Party Pack,2 metres,79,Great for a birthday or celebration. Enough to fill a table or mantelpiece nicely.,images/balloon-garlands/IMG_0473.jpeg,~80 balloons (3 sizes) | Garland tape | Tie tool | Command strips | How-to guide
diyKits,diy-003,Mega Kit,3 metres,109,"For the ambitious DIY-er. A full three metres of garland tape, balloons, and everything else.",images/balloon-garlands/IMG_0505.jpeg,~120 balloons (3 sizes) | Garland tape | Tie tool | Command strips | How-to guide
